Category,Title,Description,Full Text
Jamiyat,Raqobat qo‘mitasi yirik savdo tarmoqlariga narxlarni nazorat qilib borishni topshirdi,,Raqobat qo‘mitasi savdo tarmoqlari vakillari bilan Yangi yil bayrami arafasida oziq-ovqat mahsulotlari narxlari barqarorligini taʼminlash yuzasidan uchrashuv o‘tkazdi. Qo‘mita o‘z vakolatlari doirasida ichki bozorda isteʼmol tovarlarining narxlarini tahlil qilish hamda savdo faoliyatida raqobatni taʼminlash yuzasidan respublikamizning 8 ta yirik chakana savdo tarmoqlari vakillari bilan amaliy uchrashuv bo‘lib o‘tdi.
Jamiyat,Dunyoda birinchi marta urib turgan yurak ko‘chirib o‘tkazildi,,"Italiyaning Paduya shahrida dunyoda birinchi marta urib turgan yurak ko‘chirib o‘tkazildi.Shahar shifoxona-universitet boshqarmasi ushbu amaliyotni inqilob, deya ta’rifladi. Bunday amaliyot shifokorlarga yurak transplantatsiyasi natijalarini yaxshilash hamda nazorat ostidagi organ to‘xtab qolishining oldini olish imkonini beradi.«Shu tariqa yurakni joyidan olish va ko‘chirib o‘tkazish jarayonida ishemik va reperfuzion shikastlanishlarga barham beriladi, yurak funksiyalarining operatsiyadan so‘ng tez tiklanishi ta’minlanadi», — deyiladi xabarda.Paduya shifoxona-universitet boshqarmasi ma’lumotiga ko‘ra, bemor ayni paytda o‘zini yaxshi his etmoqda. Unga tez orada uyiga ketishiga ruxsat beriladi."
Jamiyat,The Telegraph: Saudiya Arabistoni Ukrainadagi urushni tugatishi mumkin,,"Saudiya Arabistoni Ukrainadagi urushni tugatishi mumkin, prezident Vladimir Putin rejimining qulashi esa o‘ylagandan ko‘ra yaqinroq. Bu haqda The Telegraph xabar bermoqda.Xabarga ko‘ra, Rossiyadagi iqtisodiy vaziyat tobora Germaniyaning Birinchi jahon urushi oxiridagi holatiga o‘xshab bormoqda — haddan tashqari qizigan iqtisodiyot, tugab borayotgan resurslar va malakali ishchi kuchi yetishmovchiligi. Rossiya harbiy kuchlari xuddi 1917-yildagi nemis qo‘shinlari kabi uch yillik sanksiyalar bosimidan so‘ng doimiy ravishda kadrlar va uskunalar tanqisligidan aziyat chekmoqda. Bunga ta’sir qiluvchi quyidagi omillar ham mavjud.Suriyadagi geosiyosiy mag‘lubiyatBashar Asad rejimining qulashi Rossiyaning Yaqin Sharqdagi pozitsiyalariga strategik zarba bo‘ldi. Moskva mintaqadagi asosiy ittifoqchisini qutqara olmadi, bu esa Vladimir Putinga bo‘lgan ishonchni susaytirdi. Damashqning qo‘ldan ketishi Rossiyaning Tartus va Xmeymimdagi harbiy bazalarini xavf ostiga qo‘ydi.Turkiya vaziyatdan tezda foydalandi. Anqara mintaqani nazorat qiladi va Suriyadagi rus generallarining taqdiri endi Turkiya rahbariyatiga bog‘liq. Agar Putinga Tartusdagi harbiy-dengiz bazasini saqlab qolish nasib qilsa ham, bu Turkiya shartlari asosida amalga oshadi.Iqtisodiy izolyatsiyaRossiya iqtisodiyoti kapital va inson resurslarining keng ko‘lamli chiqib ketishini boshdan kechirmoqda. Urush boshlanganidan buyon 800 mingga yaqin yosh va malakali rossiyaliklar mamlakatni tark etdi. Harbiy xarajatlar yalpi ichki mahsulotning 10 foizigacha yetmoqda, uglevodorodlar eksportidan keladigan daromadlar esa pasaymoqda. 2022-yil o‘rtalarida neft va gaz savdosidan olingan kunlik daromad 1,2 milliard dollarni tashkil etgandi. Bugungi kunda bu ko‘rsatkich 600 million dollargacha tushib ketdi.Kreml Milliy farovonlik jamg‘armasidan mablag‘ olishga majbur bo‘lmoqda, u 16 yil ichidagi eng past ko‘rsatkich — 54 milliard dollargacha qisqardi. Mamlakatning oltin zaxirasi ham so‘nggi 15 oy ichida 554 tonnadan 279 tonnagacha kamaydi. Jamg‘armada likvid aktivlar deyarli qolmadi.G‘arbning moliyaviy zarbalariAQSH uch hafta oldin “Gazprombank” va Rossiyaning 50 dan ortiq moliyaviy muassasasiga qarshi sanksiyalar joriy etib, iqtisodiy bosimni kuchaytirdi. Bu choralar xalqaro pul o‘tkazmalarini va energiya resurslari savdosini qiyinlashtirib, rubl kursiga ta’sir qildi.Saudiya Arabistoni Rossiya iqtisodiyotiga qo‘shimcha zarba berishi mumkin. Iqtisodiy mutaxassislar prognoziga ko‘ra, Ar-Riyod yo‘qotilgan mavqeini qaytarish uchun jahon bozorini yana arzon neft bilan to‘ldirib yuborishi ehtimoli bor. Agar neft narxi bir barrel uchun 40 dollardan pastlasa, Rossiya moliya tizimi izdan chiqib, qulashi mumkin.Saudiyaga qaramlikTahlilchilar ta’kidlashicha, Rossiyadagi bugungi vaziyat Sovet ittifoqining so‘nggi oylarini tobora ko‘proq eslatmoqda. Tashqi ko‘rinishdan Putin rejimi hozircha barqaror turganday, ammo uning zaiflashuv alomatlari ko‘zga tashlanmoqda. Tizimni izdan chiqarish uchun birgina jiddiy geosiyosiy yoki iqtisodiy turtki kifoya bo‘ladi.The Telegraph Rossiya-Ukraina mojarosi tarixidagi keyingi bob Ar-Riyodda yozilishi mumkinligi, Putin rejimining kelajak taqdiri aynan Saudiya Arabistonining qarorlariga bog‘liq ekanini xulosa qildi."
Jamiyat,Milliy turizm yagona platformasi ishga tushirilmoqda,,"Vazirlar Mahkamasining ""Turizm sohasini raqamlashtirish va turistik xizmatlarni yagona platformaga birlashtirish chora-tadbirlari to‘g‘risida""gi qarori qabul qilindi.Milliy turizm yagona platformasi ishga tushirilmoqda. 2025 yil 1 sentyabrdan boshlab sinov tariqasida ishga tushirilayotgan platforma quyidagilarni amalga oshirish imkonini beradi:- sayyohlarga joylashtirish vositalarini onlayn band qilish va sayyohlar tomonidan baholash;- respublikadagi turoperatorlar va turagentlar xizmatlari, shu jumladan, sayyoxlarga gid, gid-tarjimon, yo‘riqchi-yo‘l boshlovchi, ekskursiya yetakchilari xizmatlaridan foydalanish;- yo‘nalishsiz taksi va avtotransport vositalari ijarasi xizmatlaridan foydalanish;- avtobus, avia va temir yo‘l chiptalari, madaniy meros obyektlari, muzeylar va boshqa diqqatga sazovor joylarga kirish chiptalarini xarid qilish;- xalqaro va milliy to‘lov tizimlari orqali turistik xizmatlar uchun to‘lovlarni amalga oshirish;- turizm sohasiga oid statistik hisobotlarni yuritish va real vaqt rejimida tahlil qilish."
Jamiyat,Yangi yil arafasida Toshkentda maxsus arzonlashtirilgan narxlardagi savdo yarmarkalari tashkil etildi,,Yangi yil arafasida Toshkentda maxsus arzonlashtirilgan narxlardagi savdo yarmarkalari tashkil etildi.Savdo yarmarkalari quyidagi bozorlarda o‘tkazilmoqda:«Aviasozlar dehqon bozori» AJ – Yashnobod«Askiya dehqon bozori» AJ – Yakkasaroy«Chilonzor dehqon bozori» MCHJ – Chilonzor«Mirobod dehqon bozori» AJ – Mirobod«Navro‘z dehqon bozori» AJ – Mirzo Ulug‘bek«Oloy dehqon bozori» AJ – Yunusobod«Sergeli dehqon bozori» AJ – Sergeli«Farxod dehqon bozori» AJ – Uchtepa«Eski Juva dehqon bozori» AJ – Shayxontohur«Yunusobod dehqon bozori» AJ – Yunusobod«Quylik dehqon bozori» AJ – Bektemir«Qora qamish dehqon bozori» MCHJ – Olmazor. 
Jamiyat,Germaniya Suriyani qo‘llab-quvvatlash shartlarini e’lon qildi,,"Germaniya tashqi ishlar vaziri Annalena Berbok 11 dekabr, chorshanba kuni Bashar Asad rejimi ag‘darilganidan keyin Suriyani qo‘llab-quvvatlash rejasini taqdim etdi. U Berlin Damashqqa yordam berish uchun ilgari suradigan sakkiz band va shartdan iborat.Berbok hokimiyatning tinch yo‘l bilan o‘tkazilishini birinchi va eng muhim nuqta deb atadi. «Barcha partiyalar tomonidan qabul qilingan fuqarolik hukumati faqat barcha ozchiliklar va siyosiy guruhlar stol atrofida jam bo‘lsa, muvaffaqiyatli bo‘ladi», dedi u.Chet el aralashuvisiz Suriya ichidagi muloqotIkkinchi o‘rinda - Suriya ichidagi muloqot. Germaniya Tashqi ishlar vazirligi rahbarining so‘zlariga ko‘ra, u BMT rezolyutsiyalari va «joylardagi voqeliklar»ga muvofiq chet el aralashuvisiz, masalan, Turkiya yoki Isroil aralashuvisiz o‘tishi kerak. «Suriya yana xorijiy davlatlar o‘yinida piyodaga aylanmasligi kerak», dedi Berbok.Uchinchisi, «Hay’at Tahrir ash-Shom» (Hsh) a’zolari tomonidan ayollar, etnik va diniy ozchiliklar huquqlarini hurmat qilish. Berbokning aytishicha, Germaniya guruh bilan «hali to‘g‘ridan to‘g‘ri aloqaga ega emas», ammo Berlin uning «Al-Qoida» bilan aloqasi borligini biladi. «Biz Hshni uning harakatlariga qarab baholaymiz», dedi vazir.U, shuningdek, insonparvarlik inqirozini imkon qadar tezroq ortda qoldirib, Suriyani qayta tiklashni boshlashga chaqirdi. Berbok siyosiy inqiroz fonida mamlakatda yuqori inflatsiya haqida ma’lum qildi, shuning uchun asosiy oziq-ovqat mahsulotlari qimmatlashmoqda. Misol uchun, non narxi bir necha kun ichida 900 foizga oshdi. Vazir Germaniyadan 8 million yevrolik shoshilinch yordam va’da qildi.Suriyaliklarni vataniga qaytarish mojarosi: Shols vazminlikka chaqirdiGermaniya kansleri Olaf Shols suriyaliklarning Germaniyadan vataniga qaytarilishi haqidagi munozaralarda vazminlikka chaqirdi. «Endi bizning vazifamiz u yerda xavfsiz muhit yaratish imkoniyatini qo‘ldan boy bermaslik, demokratiyani dunyoga keltirish va turli dinlarga mansub odamlar normal birga yashashini ta’minlashdir», dedi Shols 10 dekabr kuni ARD telekanalida Suriyadagi vaziyat haqida.«Ehtimol, agar hamma narsa yaxshi kechsa, ko‘pchilikning o‘zi endi o‘z mamlakatini qayta tiklashda ishtirok etishni xohlashini aytishadi», deb tushuntirdi Germaniya kansleri Bashar Asad rejimi qulaganidan keyin suriyalik qochqinlarning o‘z vatanlariga qaytishi haqidagi munozaralarni sharhlar ekan. Biroq, ayni damda Suriyadagi vaziyat «juda va juda xavfli» bo‘lib qolmoqda, deya eslatdi u."
Jamiyat,Ota-onalardan darsliklar ijarasi uchun qo‘shimcha to‘lov undirish rejalashtirilmagan — Iqtisodiyot va moliya vazirligi,,"2025–2027-yillarga mo‘ljallangan Fiskal strategiya asosida ishlab chiqilgan Budjetnoma loyihasida 2025–2026-o‘quv yilidan 2–11-sinflarda bir to‘plam darslik va mashq daftarlari uchun ijara to‘lovi undirish tizimini joriy etish yuzasidan tegishli takliflar taqdim etilgan edi.Budjet jarayonlarini shakllantirishda vazirlik tomonidan, birinchi navbatda, iqtisodiy o‘sishning barqaror yuqori sur’atlari hamda iqtisodiy va ijtimoiy sohaning moliyaviy mutanosibligini ta’minlashda davlatning ijtimoiy majburiyatlarini to‘liq hamda o‘z vaqtida bajarishga ustuvor e’tibor qaratiladi. Bunda, samaradorlikni oshirish maqsadida turli yo‘nalishlar bo‘yicha tahlillar o‘tkaziladi.Ta’kidlash lozimki, 2024-yilda maktab o‘quvchilari uchun 83,2 mln nusxa darslik va mashq daftarlarini yetkazib berish uchun Davlat budjetidan jami 1,5 trln so‘m ajratilgan. Ushbu mablag‘lardan 435,5 mlrd so‘mi (yoki 36 foizi) davriyligi 1-yil hisoblanadigan hamda har yili yangidan chop etiladigan mashq daftarlari uchun yo‘naltirilgan.2025-yilda esa 81 mln nusxa darsliklar va mashq daftarlari uchun jami 1,3 trln so‘m mablag‘larni to‘liq Davlat budjetidan qoplash ko‘zda tutilgan.Shu bilan birga, ijtimoiy tarmoqlardagi faol foydalanuvchilar tomonidan chop etilgan postlarda Budjet loyihasida Kitob jamg‘armasi xarajat va daromadlari ko‘rsatilmaganiga e’tibor qaratilgan. Qayd etish joizki, Kitob jamg‘armasi faoliyati to‘xtatilgan va yangi jamg‘arma tashkil qilinmagani sababli loyihada bu bo‘yicha ma’lumotlar aks ettirilmagan.2025-yil uchun Davlat budjeti doirasida ko‘zda tutilgan mablag‘lar yangi o‘quv yilida o‘quvchilarni darsliklar va mashq daftarlari bilan ta’minlash bo‘yicha ehtiyojni to‘liq qoplash imkonini beradi.Bunda, ota-onalardan darsliklar va mashq daftarlari ijarasi uchun qo‘shimcha to‘lov undirish rejalashtirilmagan."
Jamiyat,Qatar shahzodasi Xalifa ibn Hamad Ol Soniy uylanishini e’lon qildi,,"Dunyodagi eng ko‘zga ko‘ringan Qatar hukmron oilasining vakili shayx Xalifa ibn Hamad Ol Soniy uylanishini ma’lum qildi. Bu haqda Emirates Women xabar berdi.Qatar ichki ishlar vaziri lavozimida faoliyat yuritayotgan shayx Xalifa Janubiy Kaliforniya universitetida jamoatchilik diplomatiyasi bo‘yicha magistrlik darajasini olgan. U dunyodagi eng yosh vazirlardan biri hisoblanadi.Uning onasi o‘zining go‘zalligi va ayollar huquqlari uchun kurashi bilan dunyoga tanilgan afsonaviy shayxa Moza bintu Nosir, otasi esa Qatarning sobiq amiridir.Shahzodaning rafiqasi — Al Vakrah futbol klubi menejerining qizi shayxa Fotima bintu Nosir ibn Hasan Ol Soniy bo‘lib, shaxsiy hayotini yashirin tutishni ma’qul ko‘radi.Qirollik to‘yi ulkan miqyosdagi tadbirga aylanadi, unga butun dunyodan yuqori martabali shaxslar va qirollik oilalarining a’zolari tashrif buyuradi. Hashamatli ziyofat 6-dekabr kuni Al-Vajba saroyida bo‘lib o‘tadi, 7-dekabr kuni esa erkaklar uchun marosim o‘tkazilishi rejalashtirilgan."
Jamiyat,Ogʻir atletika: Sarvarbek Zafarjonov jahon chempionatida bronza medaliga sazovor boʻldi,,"Ogʻir atletika boʻyicha Oʻzbekiston terma jamoasi aʼzosi Sarvarbek Zafarjonov Bahraynda oʻtayotgan jahon chempionatida terma jamoamiz hisobiga yana bir medalni taqdim qildi. -89 kg vazn toifasining “A” guruhida qatnashgan polvonimiz bronza medaliga sazovor boʻldi.Sarvarbek dast koʻtarish mashqida 171 kg natija qayd etib, uchinchi oʻrinni egalladi. Biroq siltab koʻtarishda 204 kg bilan oltinchi, yakunda 375 kg bilan toʻrtinchi pogʻonadan joy oldi. Hamyurtlarimizning keyingi ishtiroki 14-dekabr sanasiga toʻgʻri keladi. Unda Ruslan Nurudinov, Sharofiddin Amriddinov hamda Tursunoy Jabborova medallar uchun kurash olib borishadi."
Jamiyat,O'zbekiston Din ishlari bo'yicha qo'mitasi va Misrning Al-Azhar majmuasi o'rtasida anglashuv memorandumi imzolandi,,"O'zbekiston elchixonasi ko'magida O'zbekiston Vazirlar Mahkamasi huzuridagi Din ishlari bo'yicha qo'mita va Misrning Al-Azhar majmuasi o'rtasida anglashuv memorandumi imzolandi.Hozirgi kunda Al-Azhar majmuasi bilan kadrlar tayyorlash, ularning kasb-mahoratini oshirish, xalqaro konferensiya va seminarlar o'tkazish bo'yicha yaqin hamkorlik o'rnatilgan.Imzolangan anglashuv memorandumi diniy ta'lim olish istagidagi o'zbekistonlik yoshlarning Al-Azhar majmuasi va uning tarkibidagi o'quv muassasalariga qabul qilishni tartibga soladi.Hujjatda ta'lim yo'nalishida o'zaro axborot va tajriba almashish, birgalikda xalqaro anjumanlar tashkil qilish, buzg'unchi soxta diniy g'oyalar va ekstremizm ko'rinishlari tarqalishining oldini olishga qaratilgan targ'ibot ishlarini amalga oshirish va islom merosini chuqur o'rganish bo'yicha ilmiy tadqiqotlar o'tkazish kabi bir qator vazifalar belgilagan."
Jamiyat,“QR” kod orqali barcha qurilish obyektlarini kuzatish imkoni yaratildi,,"Maʼlumki, Prezidentimiz raisligida bo‘lib o‘tgan qurilish industriyasi va qurilish materiallarini ishlab chiqarishni yana-da rivojlantirishga oid videoselektor yig‘ilishida qurilish-montaj ishlari sifati masalasiga alohida eʼtibor qaratilib, bu borada bajarilishi shart bo‘lgan aniq vazifalar belgilab berilgan edi.Ushbu vazifalar ijrosini taʼminlash, xususan, mamlakatimiz qurilish sohasidagi jarayonlarni samarali va shaffof boshqarish maqsadida yangi qurilishlarda davlat nazorati tizimi joriy etilmoqda. Mazkur tizim zamonaviy raqamli yechimlar asosida ishlab chiqilgan bo‘lib, qurilish jarayonlarini boshqarish, hujjatlashtirish va nazorat qilishda qulay imkoniyatlar yaratadi. Tizimning asosiy maqsadi qurilish jarayonlarini izchil boshqarish, ortiqcha qog‘ozbozlikka yo‘l qo‘ymaslik va inson omili taʼsirini kamaytirish orqali sifat va xavfsizlikni taʼminlashdan iborat.Xo‘sh, tizimning o‘ziga xos yangiligi va imkoniyatlari qanday omillarda ko‘rinadi?– Dastlab cheklist tizimiga to‘xtalamiz. Ushbu tizim bilan qurilish jarayonlari bosqichma-bosqich tekshiriladi va har bir ish turi uchun to‘ldiriladigan cheklistlar orqali sifat nazorati amalga oshirilib, hujjatlashtirish jarayoni soddalashtiriladi, – deydi Qurilish va uy-joy kommunal xo‘jaligi vazirligi axborot xizmati rahbari Saidnosir Usmonov. – Tizim qurilish korxonalarining holatini avtomatik baholaydi va reytingi past bo‘lgan yoki talabga javob bermaydigan korxonalarga ruxsatnoma bermaydi.Muhim yangiliklardan yana biri, har bir obyekt uchun “QR” kodli pasport joriy etilgan bo‘lib, ushbu kod orqali obyekt haqidagi barcha maʼlumotlarni real vaqt rejimida olish mumkin. Bu respublikadagi barcha fuqarolar va jamoat nazorati vakillariga qurilish obyektlar holatini qulay tarzda kuzatish imkonini beradi.Obyektning foydalanishga qabul qilish jarayoni ham ancha soddalashtirildi. Eski tizimdagi 27 ta cheklist bandi o‘rniga, yangi tizimda faqat 7 ta band qoldirilib, jarayonni tezlashtirish va ortiqcha kechikishlarning oldini olishga yordam beradigan tizim ishga tushdi.Qurilish ishtirokchilari uchun interaktiv va qulay kabinetlar ishlab chiqildi. Har bir kabinet foydalanuvchiga moslashtirilgan bo‘lib, bu orqali ichki nazorat, texnik nazorat, mualliflik nazorati va inspektorlar uchun alohida imkoniyatlar taqdim etilmoqda.Qurilish jarayonlari tizim orqali raqamlashtirilib, qo‘shimcha ravishda obyektlar real vaqt rejimida kuzatib boriladi. Yaʼni, inspektor obyektni joyiga chiqib monitoring qilish bilan birgalikda elektron hujjat va fotosuratlar orqali obyektning holati bo‘yicha qo‘shimcha o‘rganishlarni amalga oshirish imkoniyatiga ega bo‘ldi.Barcha xulosa, yozma ko‘rsatma va tasdiqlar elektron hujjat aylanishi orqali amalga oshiriladi. Bu esa qog‘oz hujjatlariga bo‘lgan ehtiyojni kamaytirib, jarayonlarni tezlashtirishga yordam beradi.Eng muhimi, qurilish jarayonlari ""Shaffof qurilish"" milliy axborot tizimiga integratsiya qilinib, jarayonlarning shaffofligi oshirildi va korrupsiya xavfi kamaytirildi.Umuman olganda, yangi tizim qurilish jarayonlarini shaffoflashtirish, sifat nazoratini kuchaytirish va jarayonlarni soddalashtirishga xizmat qiladi. Bu innovatsion yechimlar quruvchilar va nazorat organlari uchun qulaylik yaratib, obyektni o‘z vaqtida va sifatli tayyorlab foydalanishga topshirishga imkon beradi. "
Jamiyat,Yoqilg‘i-energetika resurslari narxlarining oshishiga doir inflyatsion kutilmalar kuchaydi,,"Noyabr oyida O‘zbekiston aholisi va biznesining keyingi 12 oylik inflyatsion kutilmalari yana o‘sishni boshladi. Bu Markaziy bankning noyabr oyidagi so‘rovnomasidan kelib chiqadi.O‘tgan oy oxirida aholi o‘rtasida narx kutilmalari 13,7 foizga (oktyabrga nisbatan +0,9 foiz punkti) o‘sdi, tadbirkorlar o‘rtasida — 12,7 foizga (+0,7 foiz punkti).Bu gaz va elektr energiyasiga tariflar oshirilgan may oyidan beri eng yuqori ko‘rsatkich (o‘shanda aholi kutilmalari 14%, korxonalarniki esa 12,7% edi).Bu safar kelgusi inflyatsiyaga nisbatan eng pessimistik kayfiyat Toshkentda shakllandi. Agar oktyabr oyida aholi inflyatsiyani 11,6% da prognoz qilgan bo‘lsa, noyabrda o‘rtacha 17,7% gacha ko‘tarildi. Poytaxtlik respondentlarning deyarli yarmi (48%) kelgusi 12 oy ichida inflyatsiya 17% yoki undan yuqori bo‘lishini prognoz qilmoqda.Toshkent shahrida tadbirkorlarning kutilmalari ham 12,6 foizdan 14,6 foizga oshdi.Aholi o‘rtasida narxlarning yuqori o‘sishi ham Toshkent viloyatida — 14,8 foiz (o‘zgarishsiz) va Sirdaryo viloyatida — 14,8 foiz (+1,1 f.p.) kutilmoqda, tadbirkorlik subyektlari o‘rtasida esa Navoiy viloyatida (14,7 foiz, +0,2 f.p.).Noyabr oyida aholi o‘rtasida o‘tkazilgan so‘rovlarda narxlarning oshishiga taʼsir ko‘rsatishi mumkin bo‘lgan asosiy omil sifatida avvalgidek valyuta kursining o‘zgarishi ko‘rsatildi — respondentlarning 51 foizi ushbu variantni tanlagan (oktyabrda ham 51 foiz). Eslatib o‘tamiz, noyabr oxirida dollar deyarli 91 so‘mga (+0,71 foiz) mustahkamlandi. Umuman olganda, yil boshidan buyon milliy valyuta o‘tgan yilning shu davridagi 9,5 foizga nisbatan atigi 4,3 foizga devalvatsiyaga uchradi.Kommunal xizmatlar narxlarining oshishi ikkinchi o‘ringa ko‘tarildi — respondentlarning 51 foizi shunday fikrda (47 foizdan).Yoqilg‘i-energetika resurslari (elektr energiyasi, gaz) narxining oshishi uchinchi o‘rinni egalladi. Oktyabr oyida so‘rovda qatnashganlarning 46 foizi (47 foizi) bu omil keyingi 12 oy ichida narxlarning oshishiga taʼsir qilishini aytdi.Keyingi o‘rinlarda monopoliyalar va narxlarning — 31% (28%), transport xarajatlarining — 30% (26%), ish haqi va pensiyalarning sunʼiy oshirilishi — 28% (31%).Tadbirkorlik subyektlari uchun ham narxlar oshishining asosiy omili valyuta kursining ehtimoliy o‘zgarishi bo‘lib qolmoqda — respondentlarning 51 foizi (50 foiz edi), kommunal xizmatlar — 49 foiz (42 foiz), shuningdek, yoqilg‘i-energetika resurslari — 48 foiz (42 foiz) .Boshqa omillarga transport xarajatlarining oshishi — 32% (29%), ish haqi va pensiyalarning o‘sishi — 29% (30%), soliq yukining yuqori darajasi — 25% (23%), xomashyo narxlarining oshishi kiradi — 25%.Eng yuqori daromadga ega (15 million so‘mdan yuqori) aholi guruhlari o‘rtasida inflyatsion kutilmalar 13,9 foizdan 17,3 foizga (+3,4 foiz) o‘sdi. Inflyatsiyaning yuqori darajasi (oktyabrdagi 14,4 foizga nisbatan 16,5 foiz) 10−15 million so‘m daromadga ega respondentlar tomonidan kutilmoqda.Daromadlari 2 million so‘mgacha bo‘lgan shaxslar keyingi 12 oyda inflyatsiyani 13,1 foiz (12,1 foizni tashkil etdi), daromadi bo‘lmaganlar esa 12,1 foiz (12,3 foiz) darajasida prognoz qilmoqda."
Jamiyat,Vengriya Moskva va Kiyevga sulh tuzishni taklif qildi,,"Vengriya Ukraina va Rossiyaga «o‘t ochishni to‘xtatish»ni o‘rnatish va keng ko‘lamli mahbuslar almashinuvini o‘tkazishni taklif qildi, dedi Vengriya bosh vaziri Viktor Orban 11 dekabr, chorshanba kuni ijtimoiy tarmoqlarida.«Prezident Zelenskiy buni aniq rad etgani achinarli, biz qo‘limizdan kelganini qildik», deb yozdi Orban. U Ukraina prezidenti Volodimir Zelenskiyning Rossiya prezidenti Vladimir Putinga qo‘ng‘iroq qilgani uchun Orbanni tanqid ostiga olganini shunday izohladi.Zelenskiy Orbanning Putinga qo‘ng‘irog‘ini tanqid qildi«Biz hammamiz umid qilamizki, Viktor Orban hech bo‘lmaganda Moskvada Asadga qo‘ng‘iroq qilib, uning bir soatlik ma’ruzalarini tinglamaydi», — deb yozdi Zelenskiy Orban va Putin o‘rtasidagi telefon suhbati haqida xabarlar paydo bo‘lgach.«Haqiqiy tinchlik va kafolatlangan xavfsizlikka erishish uchun Amerikaning qat’iyati, Yevropa birligi va barcha hamkorlarning BMT Nizomi maqsad va tamoyillariga sodiq bo‘lishi talab etiladi», — deya qo‘shimcha qildi Zelenskiy. Unga ko‘ra, «hech kim o‘zining shaxsiy obro‘sini ko‘tarmasligi kerak», birlik va umumiy muvaffaqiyatga e’tibor qaratishi kerak.«Rossiyaning Ukrainaga qarshi olib borayotgan urushini Ukrainasiz muhokama qilib bo‘lmaydi», — deb yozgan Zelenskiy va AQShning saylangan prezidenti Donald Trampga, «haqiqiy tinchlik uchun to‘g‘ri va ishonchli yechimlarni topish» ustida ishlagan «Yevropaning ko‘plab yetakchilariga» minnatdorchilik bildirdi.Vengriya Ukraina bilan chegarada HMM tizimlarini o‘rnatish niyatidaVengriya mamlakatning shimoli-sharqiy qismida, Ukraina bilan chegaraga yaqin hududda havo hujumidan mudofaa tizimlarini o‘rnatishni rejalashtirmoqda. Bu haqda 20 noyabr kuni mamlakat mudofaa vaziri Kristof Salay-Bobrovnitskiy ma’lum qildi. «Biz tinchlikka harbiy yo‘l bilan emas, balki imkon qadar tezroq diplomatiya yo‘li bilan erishilishiga ishonishda davom etamiz», dedi mudofaa idorasi boshlig‘i o‘zining Facebookʼdagi sahifasida Ukrainadagi voqealarni muhokama qilish uchun bosh vazir Viktor Orban tomonidan chaqirilgan Mudofaa kengashi yig‘ilishidan so‘ng e’lon qilingan videoda.«Biroq, barcha ssenariylarga tayyorgarlik ko‘rish uchun men shimoli-sharqda yaqinda sotib olingan havo harakatini boshqarish va havo mudofaa tizimlarini o‘rnatishni buyurdim», dedi vazir."
Jamiyat,"Farg'onada 11,5 ming donadan ziyod pirotexnika vositalarining noqonuniy aylanmasiga chek qo‘yildi",,"Farg‘ona viloyati bojxona boshqarmasi Kontrabandaga qarshi kurashish bo‘limi xodimlari huquqni muhofaza qiluvchi organlar bilan hamkorlikda o‘tkazilgan tezkor tadbirda fuqarolar boshqaruvidagi “Lacetti” va “Cobalt” rusumli avtomashinalar Qo‘shtepa tumani hududida ushlanib belgilangan tartibda ko‘zdan kechirildi. Natijada, “Cobalt” rusumli avtomashinada 10 dona qutilarda dastlabki qiymati 57,8 mln so‘mlik jami 5960 dona 3 turdagi pirotexnika vositalari olib ketilayotganligi, shuningdek “Lacetti” rusumli avtomashinada esa 3 dona qutilarga solingan dastlabki qiymati 38,6 mln so‘mlik jami 5624 dona 3 turdagi pirotexnika vositalari borligi aniqlandi.O‘tkazilgan tezkor tadbir davomida qiymati 96,4 mln so‘mlik 11584 dona pirotexnika vositalari daliliy ashyo tariqasida vaqtincha saqlovga olindi.Hozirda holat yuzasidan surishtiruv harakatlari olib borilmoqda."
