Category,Title,Description,Full Text
Jamiyat,Prezident qurilish va obodonlashtirish loyihalari taqdimoti bilan tanishdi,,"Prezident Shavkat Mirziyoyev 11-dekabr kuni qurilish va obodonlashtirish loyihalari taqdimoti bilan tanishdi.Zamon rivojlangani sari odamlarning ta’bi ham, talabi ham o‘sib bormoqda. Shunga yarasha yangi qurilishlarga, munosib sharoitlarga ehtiyoj tug‘ilmoqda.  Toshkent shahridagi Yunusobod dehqon bozori hamisha gavjum, kengayishga esa joy yo‘q. Yana bir muammo – tirbandlik. Shu bois uni zamonaviy konsepsiya asosida yuqoriga “o‘stirish”, savdo o‘rinlari va qulayliklarni ko‘paytirish rejalashtirilgan. Loyihaga ko‘ra, avvalo, asliyat saqlab qolinib, hozirgisining o‘rnida uch qavatli ekobozor quriladi. Uning yonida qo‘shimcha savdo markazi hamda zargarlik uyi barpo etiladi. Eng muhimi, ushbu binolarning yerosti qismi mingdan oshiq avtomobil sig‘adigan turargoh bo‘ladi. Jami 4-5 ming ish o‘rni ochiladi.Mutasaddilarga bular sababli bozor faoliyatini to‘xtatib qo‘ymaslik, qurilishni bosqichma-bosqich amalga oshirish bo‘yicha ko‘rsatma berildi.Keyingi loyihalar istirohat bog‘larini obodonlashtirish va yangilarini qurishga oid. Poytaxtimizdagi Abdulla Qodiriy bog‘i obodonlashtiriladi. Relefdan to‘g‘ri foydalanib, yashil hududlar ko‘paytiriladi. Sayr va tomosha joylari, favvoralar, yangi planetariy quriladi. Sayyohlarni jalb qilish uchun gastro-xol tashkil etiladi. Bu Chorsu bozori, umuman, eski shahar bilan yanada uyg‘un bo‘ladi.Davlatimiz rahbari bog‘da sharoitlarni yaxshilash va an’analarni aks ettirish zarurligini ta’kidladi.– Bu rejalar yaxshi. Faqat milliy ruh qo‘shish kerak. Bu yerda shaharning tarixi, xalqimizning an’analari aks etsin. Har bir yosh toifasidagi inson bog‘da o‘z joyini topa olsin, – dedi Shavkat Mirziyoyev.“Do‘stlik” bog‘i ham yangilanib, aholini o‘ziga jalb etuvchi maskanga aylantiriladi. Sayr yo‘laklari, suv havzalari, dam olish joylari ta’mirlanib, o‘rindiqlar o‘rnatiladi. Oilaviy ko‘ngilochar maskan va bolalar ijod markazi tashkil qilinadi. Yoshlar uchun skeyt maydonchasi, daraxtlar bilan uyg‘un aviariy hamda tomosha charxpalagi quriladi.Ma’lumki, shu yerda Millatlararo munosabatlar va xorijiy mamlakatlar bilan do‘stlik aloqalari qo‘mitasi joylashgan. Uning ortidagi maydonda yurtimizdagi milliy madaniyat markazlarining pavilonlarini barpo etish rejalashtirilgan. Ular har bir millatning uyi shaklida bo‘lib, o‘ziga xos madaniyat va an’analarni ifodalaydi. Bu hudud “Do‘stlik” bog‘i bilan hamohanglik kasb etadi.Prezidentimiz tashabbusi bilan 2019 yilda Toshkent shahrida “Navro‘z” bog‘i barpo etilgan edi. Hozirgi kunda u shahar markazidagi obod va gavjum maskanlardan biri. Tashrif buyuruvchilarga sharoitlarni yanada kengaytirish maqsadida bu yerda mehmonxona, yopiq sport maydonchasi, restoran, konferensiya zali bunyod qilish ko‘zda tutilmoqda.Mamlakatimizda hududlarni kompleks rivojlantirish doirasida barcha joylarda yangi mavzelar, parklar, ko‘ngilochar maskanlar qurilmoqda. Jumladan, Nurafshon va Namangan shaharlarida ham “Yangi O‘zbekiston” bog‘lari barpo etilgan. Navbatdagi loyihalar ulardan foydalanish samaradorligini oshirish va mehmonlarni ko‘proq jalb etishga qaratilgan.Buning uchun Nurafshon va Namangandagi “Yangi O‘zbekiston” bog‘lari yonida turizm markazlari tashkil qilinadi. Ularda Sharq bozori, hunarmandchilik joylari, amfiteatr, favvora va boshqa qurilmalar bo‘ladi. Daraxtlar ekilib, yashil hudud kengaytiriladi.Davlatimiz rahbari loyihalarni sifatli qilish, bog‘larda aholi va turistlar uchun qulay sharoitlarni yaratish bo‘yicha ko‘rsatmalar berdi."
Jamiyat,Shavkat Mirziyoyev va Vladimir Putin telefon orqali gaplashdi,,"Prezident Shavkat Mirziyoyev va Rossiya Federatsiyasi Prezidenti Vladimir Putin 11-dekabr kuni bo‘lib o‘tgan telefon orqali muloqotda O‘zbekiston-Rossiya keng qamrovli strategik sheriklik va ittifoqchilik munosabatlarini yanada rivojlantirish va mustahkamlashning dolzarb masalalarini muhokama qildilar.Rossiya Prezidentining joriy yil may oyida O‘zbekistonga davlat tashrifi davomida erishilgan kelishuvlarni yetakchilar tomonidan tasdiqlangan ""yo‘l xaritasi"" asosida amalga oshirish masalalari atroflicha ko‘rib chiqildi.Kuni kecha Moskva shahrida o‘tgan Iqtisodiy hamkorlik bo‘yicha hukumatlararo qo‘shma komissiyaning navbatdagi yig‘ilishi va ikki tomonlama muzokaralarning natijalari yuqori baholandi.O‘zaro tovar ayirboshlash ko‘rsatkichlari o‘sishini ta’minlash, sanoat, energetika, transport, qishloq xo‘jaligi va boshqa tarmoqlarda kooperatsiya loyihalarini jadallashtirish, O‘zbekiston va Rossiya hududlari hamda ishbilarmon tashkilotlari darajasida faol muloqotlarni davom ettirishga qaratilgan o‘zaro muvofiqlashtirilgan choralar ko‘rish muhimligi ta’kidlandi.Innovatsiyalar, sun’iy intellekt, ta’lim va tibbiyot sohalarida hamkorlik kengayib borayotgani mamnuniyat bilan qayd etildi. Noyabr oyida Rossiyada O‘zbekiston madaniyati kunlari doirasidagi tadbirlar muvaffaqiyatli o‘tkazildi.Xalqaro kun tartibidagi masalalar hamda joriy yil dekabr oyi oxirida bo‘lib o‘tadigan oliy darajadagi uchrashuvlarga tayyorgarlik ko‘rish nuqtayi nazaridan mintaqaviy tashkilotlardagi ko‘p tomonlama hamkorlik yuzasidan ham fikr almashildi."
Jamiyat,Zargarlik buyumlarini ishlab chiqaruvchilarga soliq imtiyozlari beriladi,,"2027 yil 1 sentyabrga qadar “O‘zbekzargarsanoati” uyushmasiga aʼzo bo‘lgan zargarlik buyumlarini ishlab chiqaruvchi tadbirkorlar mol-mulk va yer solig‘idan ozod etilishi mumkin.Shuningdek, xorijda ishlab chiqarilgan qimmatbaho metallardan va qimmatbaho toshlardan yasalgan zargarlik va boshqa buyumlarni bojxona to‘lovlari to‘langanini tasdiqlovchi hujjatlarsiz sotuvga qo‘yish hamda chakana savdoda realizatsiya qilish taqiqlanishi kutilmoqda.  Bu haqda Oliy Majlis Qonunchilik palatasining majlisida ko‘rib chiqilgan zargarlik sanoatini yana-da rivojlantirishga qaratilgan qonun loyihasi muhokamaci davomida aytib o‘tildi.  Qayd etilganidek, qonun loyihasida ayrim qonun hujjatlariga zargarlik buyumlarini ishlab chiqaruvchilarning qimmatbaho metallarga bo‘lgan talabini qondirish, ularning rivoji uchun qulay biznes muhitini yaratish va qonunchilikda mavjud bo‘lgan byurokratik to‘siqlarni liberallashtirishga qaratilgan bir qator o‘zgartirish va qo‘shimchalar kiritish taklif etilmoqda.  Xususan, affinaj korxonalariga (tarkibida qimmatbaho metall va toshlar bo‘lgan xom ashyo bilan ishlash faoliyatini litsenziya asosida amalga oshiruvchi korxonalar) qimmatbaho metallarni zargarlik buyumlari ishlab chiqaruvchilar uchun qulay shakl va miqdorlarga keltirgan holda sotish hamda qimmatbaho metallardan suvenir tangalar tayyorlash va realizatsiya qilish huquqini berish nazarda tutilyapti.  Shuningdek, zargarlik buyumlari ishlab chiqaruvchilarga ham o‘zlari yasagan zargarlik buyumlarining xomaki mahsulotlarini boshqa ishlab chiqaruvchilarga realizatsiya qilish huquqi berilmoqda. Bundan tashqari, yuridik va jismoniy shaxslardan qimmatbaho metallarni va zargarlik buyumlarini sotib olish faoliyati vakolatli organni xabardor qilish tartibida amalga oshirishi belgilanmoqda.  "
Jamiyat,O‘zbekistonning Rossiyadan qarzdorligi oshdi,,"Rossiya 2023-yil boshqa mamlakatlarga kredit berish hajmini sezilarli oshirib, 30 milliard dollardan ortiq ko‘rsatkichga erishdi. Bu 1999-yildan beri qayd etilgan eng yuqori ko‘rsatkichdir. Ushbu ma’lumotlar Jahon banki tahlillari asosida aniqlandi.Eng ko‘p kreditlar Misr, Bangladesh va Hindistonga berilgan. Chet davlatlarning Rossiya oldidagi qarzi 2023-yilda 1,3 milliard dollarga oshib, jami 30,1 milliard dollarni tashkil etgan. Qarz miqdori bundan oldin faqat 1999-yilda 32,8 milliard dollar bo‘lgandi.Eng yirik qarzdor Belarus bo‘lib qolmoqda — uning qarzi 7,75 milliard dollarni yoki Rossiya bergan barcha kreditlarning chorak qismini tashkil etadi. Ikkinchi o‘rinda 6,6 milliard dollar (22 foiz) bilan Bangladesh tursa, uchinchi o‘rinni 4,1 milliard dollar (14 foiz) bilan Hindiston egallagan. Beshinchi o‘ringa Misr (3,3 milliard dollar, 11 foiz) va Vyetnam (1,4 milliard dollar, 5 foiz) kiradi.O‘tgan yili eng ko‘p qarz olgan mamlakat Misr bo‘ldi — uning majburiyatlari biryo‘la 1,45 milliard dollarga oshdi. Bangladeshning qarzi 745 million dollarga, Hindistonniki esa 363 million dollarga ko‘paydi. O‘zbekistonning qarzdorligi 41,3 million dollarga, Afg‘onistonniki esa 19,9 million dollarga o‘sdi.O‘tgan yili yangi qarzdor davlat — Nikaragua paydo bo‘ldi. U 2003-yildan buyon ilk bor Rossiyadan 16,9 million dollar miqdorida qarz oldi.Qarzi kamaygan davlatlarShu bilan birga, bir qator davlatlarning Rossiya oldidagi qarzlari kamaydi. Bu borada Somali yetakchilik qilmoqda, chunki Rossiya uning deyarli barcha qarzini kechgan: agar 2022-yil oxirida mamlakat 703 million dollar qarzdor bo‘lgan bo‘lsa, o‘tgan yil oxiriga kelib bu miqdor atigi 49 million dollargacha tushdi.Bundan tashqari, Belarusning qarzi 487 million dollarga, Serbiyaning qarzi 117 million dollarga, Armanistonning qarzi 40 million dollarga, Ozarbayjonning qarzi esa 22 million dollarga kamaydi. Yana 10 ta davlat Rossiya oldidagi 82 million dollarlik qarzini to‘liq to‘ladi."
Jamiyat,Markaziy Osiyo davlatlarida ishsizlik darajasi e’lon qilindi,,"Markaziy Osiyo davlatlari orasida eng past ishsizlik darajasi Qirg‘izistonda(3,3 foiz) qayd etildi. Xalqaro mehnat tashkiloti (XMT) tegishli ma’lumotni e’lon qildi.Tashkilot dunyoning 187 ta davlati orasida ishsizlik darajasi reytingini taqdim etgan. O‘zbekiston mazkur reytingda 113-o‘rinni egallamoqda. Markaziy Osiyo mamlakatlarida esa foizlik ko‘rsatkichlar quyidagicha: Turkmanistonda ishsizlik darajasi 4,3 foiz (117-o‘rin), O‘zbekistonda 4,5 foiz, Qozog‘istonda esa 4,8 foiz (104-o‘rin).Mintaqadagi eng yuqori ko‘rsatkich Tojikistonda kuzatilgan, u yerda ishsizlik darajasi 11,6 foizga (29-o‘rin) yetgan. Bu qo‘shni mamlakatlar ko‘rsatkichlaridan ancha yuqori.Dunyodagi eng yomon ko‘rsatkichlar Esvatini (34,4 foiz), Janubiy Afrika Respublikasi (33,2 foiz), Jibuti (25,9 foiz), Botsvana (23,1 foiz) va Gabonda (20,1 foiz) qayd etilgan. Ishsizlik darajasining eng past ko‘rsatkichlari esa Qatarda (0,1 foiz), Kamboja (0,3 foiz) va Nigerda (0,4 foiz) kuzatilmoqda.Dunyoda o‘rtacha ishsizlik darajasi 5 foizni, Afrikada 6,5 foizni, Amerikada 5,5 foizni, Osiyo-Tinch okeani mintaqasida 4,2 foizni, Yevropa va Markaziy Osiyoda 5,5 foizni tashkil etdi."
Jamiyat,NBC: AQSh “Hayat Tahrir ash-Shom”ni terrorchi tashkilotlar ro'yxatidan olib tashlashi mumkin,,"AQSh prezidenti Jo Bayden ma’muriyati Suriya prezidenti Bashar al-Asadni hokimiyatdan ag‘dargan “Hayat Tahrir ash-Shom” guruhini xorijiy terrorchilik tashkilotlari ro‘yxatidan chiqarish imkoniyatini ko‘rib chiqmoqda. Bu haqda NBC News telekanaliga AQShning yuqori martabali amaldorlari xabar berishdi.Muhokamalardan maqsad, mulozimlardan biri, “jahon hamjamiyatining yangi hukumat bilan muloqot qilish yoʻlini yaratish”dir. Ikki manba HTSning terrorchilar ro‘yxatidan olib tashlanishi “tez orada” amalga oshishi mumkinligini aytdi, biroq uchinchisi munozaralar hali boshlang‘ich bosqichda ekanligini ta’kidladi.Agar tarixan Al-Qoida bilan bogʻliq HTSdan terrorchi maqomi olib tashlanishi haqida qaror qabul qilinsa, bu guruh rahbari haqidagi maʼlumot uchun 10 million dollar mukofot bekor qilinishini ham anglatadi.Oq uy yaqin haftalarda HTS mintaqani qanday boshqarishini ko‘rishni istamoqda, biroq hozirdanoq guruhni terrorchilik tashkilotlari ro‘yxatidan chiqarish uchun zarur bo‘lgan variantlar va huquqiy mulohazalarni faol o‘rganmoqda, deydi manbalar."
Jamiyat,Eron Afg‘oniston bilan chegarada 80 km devor qurdi,,"Eron Islom Respublikasi armiyasi Shimoli-sharqiy operativ shtab qo‘mondoni Siros Omanullohiy mamlakatni muhojirlarning kirib kelishidan himoya qilish uchun hozirgacha Afg‘oniston bilan chegarada 80 kilometrlik to‘sish ishlari yakunlanganini aytdi. Bu haqda “AVApress” xabar berdi.Nashrga ko‘ra, bu shtab hozirgacha bloklangan. “Fars” xabariga ko‘ra, Eron armiyasining Shimoli-sharqiy operativ shtab qo‘mondoni, shuningdek, armiyaning shimoli-sharqiy mintaqaviy shtab-kvartirasi tomonidan mamlakat sharqiy chegaralarini qo‘riqlash burchiga ishora qilgan.Chegara blokadasi uchun ko‘rilgan chora-tadbirlarga to‘xtalar ekan, Eron armiyasi quruqlik qo‘shinlarining Janubi-sharqiy shtab qo‘mondoni ham devor, chegara datchiklari, qo‘riqlash minoralari, joylashtirish uchun zarur bo‘lgan barcha jihozlar shu vositalar qatorida ekanini tushuntirgan.Ma’lumot uchun, sentyabr oyida Eron Ichki ishlar vaziri Iskandar Momeniy Eron chegarani yopish uchun devorga qo‘shimcha ravishda tikanli sim va suv bilan to‘ldirilgan ariqlardan foydalanishini ma’lum qilgan. Shuningdek, 13 sentyabr kuni parlament Milliy xavfsizlik qo‘mitasi matbuot kotibi Ibrohim Rizoiy politsiya yaqin kelajakda ikki milliondan ortiq noqonuniy fuqarolarni chiqarib yuborishni rejalashtirganini aytgan.Ma’lumotlarga ko‘ra, joriy yil mart oyidan beri Eron ro‘yxatga olingan 2,7 milliondan ortiq afg‘on qochqinini qabul qilgan. Bu raqam mamlakatdagi qonuniy muhojirlarning 97 foizini tashkil qiladi."
Jamiyat,Sirojiddin Boboqulov kambag‘allikni qisqartirish va bandlik vaziri o‘rinbosari v.b. bo‘ldi,,"Sirojiddin Suyunovich Boboqulov kambag‘allikni qisqartirish va bandlik vazirining o‘rinbosari vazifasini bajaruvchi etib tayinlandi, deya xabar bermoqda vazirlik matbuot xizmati.Tayinlovga qadar Sirojiddin Boboqulov bosh vazir kotibiyati “mahalla yettiligi”, yoshlar siyosati va ma’naviyat masalalari departamenti Tashqi mehnat migratsiyasi masalalari bo‘limi boshlig‘i lavozimida faoliyat yuritgan."
Jamiyat,O'zbekiston va Hindiston o'zaro havo qatnovlarini haftasiga 28 taga yetkazish bo'yicha kelishuvga erishdi,,"Hindistonning ommabop ""Travel Trends Today"" (T3) jurnalida ushbu mamlakatning yirik shaharlarida O'zbekiston sayyohlik salohiyati va ""Uzbekistan Airways"" milliy aviakompaniyasining yangi yo'nalishlariga bag'ishlab o'tkazilayotgan turkum taqdimot marosimlari haqida maqola chop etildi.""Uzbekistan Airways"" AJ, O'zbekistonning Dehlidagi elchixonasi va ""Arya Enterprises"" kompaniyasi hamkorligida tashkil etilgan ushbu yorqin tadbirlarda Hindistonning yirik sayyohlik kompaniyalari, mehmondo'stlik sanoati va ishbilarmon doiralari vakillari ishtirok etmoqda.Jurnal Haydarobodda bo'lib o'tgan roud-shouda Telangana shtati va unga tutash hududlar sayyohlik hamjamiyatining taniqli vakillari hindistonlik sayohatchilar uchun O'zbekistonga turlar tashkil etish bo'yicha istiqbolli loyihalarni muhokama qilish uchun ajoyib imkoniyatga ega bo'lganini yozgan. Ular, xususan, ikki davlat o'rtasidagi aviareyslarning bugungi holati va o'zaro havo qatnovlarini yana-da ko'paytirish borasidagi sa'y-harakatlarga yuqori baho berdi.""Tadbir qiziqarli munozaralarga turtki berdi. Uning doirasida O'zbekistonning jozibador va rang-barang sayyohlik yo'nalishi sifatidagi mavqei haqida qimmatli fikrlar bildirildi"", – deb ta'kidlagan nashr muxbiri.Roud-shou doirasida ""Uzbekistan Airways"" kompaniyasi 2025-yilgi yozgi jadvaldan boshlab haftaning juma kunlari Toshkent va Mumbay o'rtasida uchinchi reysni amalga oshirishni rejalashtirayotgani ma'lum qilindi. Hozirda bu shaharlar seshanba va shanba kunlari haftasiga ikkita reys orqali bog'langan.Ta'kidlash kerakki, mamlakatimiz elchixonasi va ""Uzbekistan Airways"" milliy aviakompaniyasining izchil sa'y-harakatlari natijasida so'nggi bir yil ichida O'zbekiston va Hindiston o'rtasidagi havo qatnovi uch baravarga oshdi.2023-yil avgust oyida Toshkent va Dehli shaharlari o'rtasida ""Uzbekistan Airways"" aviakompaniyasi tomonidan haftasiga olti marta parvoz amalga oshirilgan edi. Bugungi kunda ikki mamlakat poytaxtlarini ""Uzbekistan Airways"" va ""IndiGo"" (Hindiston) kompaniyalari tomonidan yo'lga qo'yilgan 14-ta aviareys bog'lab turibdi. ""Uzbekistan Airways"" joriy yil aprel oyida Mumbay shahri va oktyabr oyida Goa shtatiga haftasiga ikki martadan yangi parvozlarni o'zlashtirgach, haftalik ko'rsatkich 18 taga yetdi.Yaqinda Kuala-Lumpur (Malayziya) shahrida bo'lib o'tgan Xalqaro fuqaro aviatsiyasi tashkiloti (ICAO)ning ICAN-2024-tadbiri doirasida O'zbekiston va Hindiston transport va fuqaro aviatsiyasi muassasalari vakillari o'zaro parvozlar miqdorini haftasiga 28 taga yetkazish bo'yicha kelishuvga erishdi.Yangi parvozlar jug'rofiyasi Samarqand, Buxoro, Namangan, Amritsar, Bangalor, Haydarobod, Chennay va boshqa shaharlarni qamrab olishi rejalashtirilmoqda. "
Jamiyat,Toshkentda talabalarga chipta sotib olish uchun sayyor kassalar tashkil etildi,,"Toshkent shahridagi O‘zbekiston milliy universiteti va Toshkent davlat iqtisodiyot universiteti binolarida chipta sotib olish uchun sayyor kassalar tashkil etildi.Transport vazirligi axborot xizmati xabariga ko‘ra, mazkur sayyor kassalarda talabalar temiryo‘l hamda avtobus qatnovlariga chiptalarni sotib olishlari mumkin.Sayyor kassalar quyidagi manzillarda tashkil etilgan:Manzil: Olmazor tumani Talabalar shaharchasi Universitet ko‘chasi 4-uy.Manzil: Yunusobod tumani Amir Temur ko‘chasi 60-A-uy. Sobiq Toshkent moliya instituti binosi."
Jamiyat,11-dekabr kuni O‘zbekistonda sodir bo‘lgan muhim voqealar dayjesti,,"Germaniyaning Transfermarkt portali Fransiya chempionatida faoliyat yuritayotgan futbolchilarning transfer bahosini yangiladi.O‘zbekiston yoshlarni kasb-hunarga o‘rgatish, ularni munosib haq to‘lanadigan ish bilan taʼminlashda Germaniya tajribasidan foydalanadi. Bu haqda oliy taʼlim, fan va innovatsiyalar vaziri Kongratbay Sharipov maʼlum qildi.Toshkent shahrida metalni qayta ishlash zavodi tomonidan 26,9 milliard so‘mlik elektr energiyasidan noqonuniy foydalanilganligi fosh etildi.Toshkentda yangi yil bayram tadbirlari o'tadigan manzillar ro'yxati e'lon qilindi.Jo‘rabek Mirzamahmudov shundan kelib chiqib, uzoq muddatli istiqbolda atom energiyasi energiya balansining zaruriy qismi sifatida ko‘rib chiqilishini ta’kidladi.Prezident tomonidan Oliy Majlis Senatiga Markaziy bank boshqaruvi raisi Mamarizo Nurmuratovni egallab turgan lavozimidan ozod etish to‘g‘risida taqdimnoma kiritildi.PFL 2024 yil yakunlari bo‘yicha O‘zbekiston chempionatining eng yaxshilarini e’lon qildi.O‘rtacha ta’mirdagi uylar uchun narxlar 1,3%ga tushgan. To‘liq ta’mirlangan toifadagi xonadonlardan esa, faqat talab kam bo‘lgan 4 xonali uylar uchun narxlar pastladi.Ma’lumot uchun, Xidian universiteti elektronika, telekommunikatsiya va axborot texnologiyalari sohalarida kuchli ilmiy bazasi bilan mashhur.Muhandislik, geologiya, ishlab chiqarish, qurilish, transport, energetika, axborot texnologiyalari va dasturlash, xizmat ko'rsatish hamda irrigatsiya tizimlari va agrotexnologiyalar sohalari bo'yicha kadrlar tayyorlash, qayta tayyorlash va ularning malakasini oshirish universitetning asosiy vazifalaridan biri etib belgilandi.Alisher Navoiy nomidagi Milliy kutubxona oldidagi maydon yaqinidagi ko‘chalar Yangi yil bayrami munosabati bilan avtomobillar harakati uchun yopildi, deya xabar bermoqda poytaxt hokimligi axborot xizmati."
Jamiyat,Qishda Rossiya va Ukraina muzokaralarni boshlashi mumkin,,"Ukraina bo‘yicha tinchlik muzokaralari shu qishda boshlanishi mumkin. Bu haqda Polsha Bosh vaziri Donald Tusk ma’lum qildi.Tuskning ta’kidlashicha, Varshava 1 yanvardan boshlab Yevropa Ittifoqiga raislik qila boshlaganida har qanday muzokaralarda faol ishtirok etadi.“Biz siyosiy voqealar taqvimi qanday ko‘rinishi va muzokaralar paytidagi vaziyat uchun javobgar bo‘lamiz, garchi bu aniq bo‘lmasada, kelishuv qishda boshlanishi mumkin”, degan Donald Tusk.Shuningdek, Tusk Fransiya Prezidenti Emmanyuel Makron va Buyuk Britaniya Bosh vaziri Kir Starmerning Varshavaga tashrifi haqida ma’lum qilgan."
Jamiyat,Tramp tashqi siyosatdagi eng muhim vazifasi nima ekanligini aytdi,,"Donald Tramp Fransiyaning Paris Match nashriga bergan intervyusida AQSh prezidenti sifatida ish boshlagach, uning uchun tashqi siyosatdagi eng muhim masala Ukraina inqirozini hal etish ekanini ma’lum qildi.«Biz Ukraina va Rossiya muammosini hal etishimiz zarur», — dedi Tramp. Uning so‘zlariga ko‘ra, Yaqin Sharq ham «istiqboldagi muhim masala», biroq u yerdagi vaziyat Ukraina masalasichalik murakkab emas.Tramp Rossiyaning Ukrainaga qarshi urushida halok bo‘lgan «yuz minglab askarlar»ni ham eslab o‘tdi. Ukrainadagi urush ham, Yaqin Sharqdagi vaziyat ham «tez hal etilishi» zarur, deya ta’kidladi Tramp."
