Category,Title,Description,Full Text
Jamiyat,Буюк Британияда биринчи марта дрон лазер ёрдамида уриб туширилди,,"Британия армияси биринчи марта зирҳли машинага ўрнатилган юқори энергияли лазер қуролидан муваффақиятли фойдаланди. Унинг ёрдамида учувчисиз учиш аппарати муваффақиятли йўқ қилинди, деб хабар берди Британия Мудофаа вазирлиги.Синовдан ўтган қурол инфрақизил ёруғликнинг кучли нурини энергия кўринишида нишонга йўналтиради. Нишонга олишнинг аниқлиги илғор сенсорлар ва кузатув тизимлари томонидан таъминланади. Анъанавий қурол турларидан муҳим афзаллик - бу ўқ-дорилар сонига чекловнинг йўқлиги. Британия Мудофаа вазирлиги бу лазер қуролларини мавжуд қуролларга нисбатан тежамкорроқ бўлишини таъкидлади.Синовлар давомида лазер Британия ва Украина армиялари томонидан фойдаланиладиган Wolfhound кўпмақсадли зирҳли машинасига ўрнатилди. Отишма Уэлс марказидаги Раднор полигонида содир бўлди.«Энергия лазер қуролини намойиш қилувчи қурилманинг муваффақиятли синовдан ўтказилиши келажакдаги имкониятлар сари муҳим қадамдир. Бу технология қуролли кучларимиз самарадорлигини ошириб, ҳозирги ва келажакдаги таҳдидларни енгиш учун ишончли ва тежамкор воситаларни таклиф қилиши мумкин», деди Мэтт Корк, қуролни ишлаб чиқишда иштирок этган Hersa Dstl жамоаси раҳбари.Аввалроқ, АҚШ армияси биринчи бўлиб жанговар шароитларда лазер қуролларини муваффақиятли қўллаган эди. Лабораториялар ва синов майдончаларида лазерлар 1970 йиллардан бери нишонларни муваффақиятли йўқ қилмоқда. Аммо ҳақиқий жангда ҳали ҳеч ким буни уддалай олмаётган эди."
Jamiyat,Toshkentda sodir bo‘lgan YTHda 18 yoshli haydovchi vafot etdi,,"11-dekabr kuni Toshkent shahar Shayxontohur tumani Ko‘kcha darvoza ko‘chasi, Suzuk ota mahalla arkasi qarshisida soat 20:20 larda YTH sodir bo‘ldi. Toshkent shahar IIBB YHXB xabar berishicha, 1988 yilda tug‘ilgan haydovchi R.K. boshqaruvidagi BYD va 2006 yilda tug‘ilgan A.X. boshqaruvidagi Equinox to‘qnashgan.Hodisa oqibatida Equinox haydovchisi shifoxonada vafot etgan. Mazkur holat yuzasidan Toshkent shahar IIBB Tergov boshqarmasi tomonidan Jinoyat kodeksining 266-moddasi 2-qismi (transportni ta’mirlash yoki uni foydalanishga chiqarish qoidalarini buzish odam o‘lishiga sabab bo‘lsa) bilan jinoyat ishi qo‘zg‘atilib, dastlabki tergov harakatlari olib borilmoqda."
Jamiyat,Qozog‘istonda kelin o‘g‘irlaganlik uchun jazo kuchaytiriladi,,"Qozog‘iston parlamenti qonunchilikka kelin o‘g‘irlaganlik uchun jazoni kuchaytiruvchi tuzatishlar tayyorlamoqda. Bu haqda parlament spikeri Erlan Koshanovga tayanib Tengrinews xabar berdi.Nashrning yozishicha, prezidentning Atirauda bo‘lib o‘tgan Milliy qurultoy yig‘ilishida bergan topshirig‘ini bajarish maqsadida deputatlar qonunchilikka kelin o‘g‘irlaganlik uchun jazoni kuchaytirish bo‘yicha tuzatishlar tayyorlamoqda.15 mart kuni prezident Qosim-Jo‘mart To‘qayev Milliy qurultoy yig‘ilishida Qozog‘istonda kelin o‘g‘irlash holatlari haqida gapirgan edi.«Mamlakatimizda go‘yoki milliy urf-odatlarni bahona qilib, kelin o‘g‘irlash amaliyotini tatbiq etishga urinayotganlar ham borki, bunday xurofotni umuman oqlab bo‘lmaydi. Bu progressiv jamiyat ideallariga, jumladan, har bir insonning qadr-qimmati, huquq va erkinliklari mutlaq ustun turadigan jamiyatga zid keladi. Bunday faktlar nafaqat ma’naviy qoralashni, balki huquqiy baho berishni ham talab qiladi», degan edi prezident.Shu yilning fevral oyida Qozog‘istondagi Inson huquqlari bo‘yicha komissari Artur Lastayev Chimkentda shov-shuvli tarzda kelin o‘g‘irlanishi haqida bayonot berib, majburan turmushga chiqqan qizlar ko‘pincha sheriklari tomonidan jinsiy, jismoniy va ruhiy zo‘ravonlik qurboni bo‘lishini aytgan edi."
Jamiyat,AQShda kongressmenlar 2025 yil uchun mudofaa budjetini tasdiqladi,,"11 dekabr, chorshanba kungi keskin muhokamalardan so‘ng AQSh kongressmenlari 2025 yil uchun munozarali AQSh mudofaa budjetini tasdiqlash uchun ovoz berishdi. Loyiha 895 milliard dollarlik rekord budjetni o‘z ichiga oladi, bu mudofaa xarajatlarini 2024 yilga nisbatan bir foizga oshirishni anglatadi.Qonun loyihasini 281 kongressmen yoqlab chiqqan bo‘lsa, 140 kishi qarshi ovoz berdi. Ular orasida 124 nafar demokrat va 16 nafar respublikachi bor. Kelgusi hafta hujjat Senatda ko‘rib chiqilishi va mudofaa budjeti loyihasi tasdiqlanishi kutilmoqda. Shundan so‘ng uni AQShning amaldagi prezidenti Jo Bayden imzolashi kerak.1800 sahifalik hujjat mudofaa, energetika vazirliklari, AQSh Davlat departamenti, shuningdek, razvedka idoralari va milliy xavfsizlik dasturlarini moliyalashtirishni belgilaydi. 2025 yilda amerikalik harbiy xizmatchilarning maoshini kichik serjantlar uchun 14,5 foizga, boshqa xodimlar uchun esa 4,5 foizga oshirish rejalashtirilmoqda. Shuningdek, qonun loyihasida bolalarni boqish va harbiy xizmatchilarning yashash sharoitlarini yaxshilash uchun katta miqdorda mablag‘ ajratish ko‘zda tutilgan.YeI davlatlari AQSh yordami qisqarsa ham Kiyevni qo‘llab-quvvatlashga tayyorYevropa Ittifoqining eng yirik iqtisodiyotlari – Germaniya, Fransiya, Italiya va Ispaniya, shuningdek, Yevropa Ittifoqiga a’zo bo‘lmagan Buyuk Britaniya AQShning Kiyevni qo‘llab-quvvatlashi qisqarishi ehtimoli fonida Ukrainaga yordam ko‘rsatish bilan bog‘liq harbiy va moliyaviy yukni o‘z zimmasiga olishga tayyor. Bu haqda 19 noyabr kuni Polsha tashqi ishlar vaziri Radoslav Sikorskiy Varshavada yuqoridagi davlatlar tashqi ishlar vazirlari, YeI tashqi ishlar va xavfsizlik siyosati bo‘yicha oliy vakili lavozimida Jozep Borrelni almashtirishi kerak bo‘lgan estoniyalik Kaya Kallas ishtirokidagi uchrashuv yakunlari bo‘yicha jurnalistlar bilan suhbatda ma’lum qildi. «Men Yevropa Ittifoqining eng yirik davlatlari AQShning ishtiroki qisqarishi (Kiyevni qo‘llab-quvvatlashda) munosabati bilan Ukrainaga harbiy va moliyaviy yordam yukini o‘z zimmasiga olishga tayyorligini hurmat bilan e’tiborga olaman», — deya AFP Polsha tashqi ishlar vazirligi rahbaridan iqtibos keltirmoqda.Germaniya, Fransiya, Italiya va Polsha tashqi ishlar vazirlarining Varshavadagi uchrashuvi Rossiyaning Ukrainaga keng ko‘lamli harbiy bostirib kirishi boshlangani 1000 kunligiga to‘g‘ri keldi. Ushbu tadbirdagi muhim mavzu Donald Tramp Oq uyga qaytganidan keyin Yevropa Ittifoqi va AQSh o‘rtasidagi munosabatlar rivoji ham bo‘ldi. Muhokamalarga Ispaniya va Buyuk Britaniya tashqi ishlar vazirlari onlayn tarzda qo‘shildi."
Jamiyat,Yevropa Ittifoqi Rossiyaning maxfiy tankerlariga qarshi kurashadi,,"11 dekabr kuni Yevropa Ittifoqi davlatlarining doimiy vakillari Bryusselda Rossiyaga qarshi navbatdagi, 15-sanksiya paketini ma’qulladi. Bu haqda DW xabar berdi.Yevropa Komissiyasi rahbari Ursula fon der Lyayyen so‘zlariga ko‘ra, cheklovlar «maxfiy flot» - Rossiya neftini eksport qilish uchun foydalaniladigan tankerlar guruhiga qarshi kurashga qaratilgan. Shuningdek, sanksiyalar ro‘yxatiga Rossiyaga G‘arb cheklovlarini chetlab o‘tishga yordam berayotgan yangi odamlar va kompaniyalar ham qo‘shiladi.Ushbu sanksiyalar 16 dekabr kuni Yevropa Ittifoqi kengashida tashqi ishlar vazirlari tomonidan tasdiqlanishi kerak.Shu bilan birga, Yevropa Ittifoqi allaqachon 16-paketni tayyorlamoqda, bu esa Rossiyaning Ukrainaga keng ko‘lamli bostirib kirishi boshlanganining uch yilligiga to‘g‘ri kelishi mumkin. Uning «yanada keng ko‘lamli» bo‘lishi kutilmoqda."
Jamiyat,Maktablarda qishki ta’til vaqti e’lon qilindi,,"Ota-onalar, o‘quvchilar va pedagoglarga qulaylik yaratish hamda o‘quv jarayonlarining uzluksizligini ta’minlash maqsadida qishki ta’til kunlari 2024 yil 29 dekabrdan boshlanib, 2025 yil 11 yanvarga qadar davom etadi, deyiladi Maktabgacha va maktab ta’limi vazirligi xabarida.Qayd etilishicha, bunda maktablarda 2025 yil 11 yanvar (shanba) kuniga belgilangan darslar 2024 yil 28 dekabr (shanba) kuniga o‘tkaziladi hamda o‘quv yilining 3-choragi 2025 yil 13 yanvar (dushanba)dan boshlanadi."
Jamiyat,Ilon Mask 400 milliard dollardan ko‘p boylikka ega dunyodagi birinchi insonga aylandi,,"Amerikalik tadbirkor Ilon Maskning sof kapitali 50 mlrd dollarga oshib, 400 mlrd dollardan ko‘proqqa yetdi.Endilikda, Bloomberg milliarderlar indeksiga ko‘ra, SpaceX asoschisining kapitali 439,2 milliard dollarni tashkil etmoqda. Bloomberg nashriga ko‘ra, Mask boyligi 400 milliard dollardan oshgan birinchi odam bo‘ldi.AQShdagi prezidentlik saylovlarida Donald Tramp g‘alaba qozonganidan keyin tadbirkorning mulki keskin oshdi. Mask, shuningdek, respublikachining bo‘lajak hukumatida ham o‘rin egalladi. The New York Times federal hujjatlarga tayanib yozganidek, milliarder Trampga saylovda g‘alaba qozonishiga yordam berish uchun 250 million dollardan ortiq mablag‘ sarflagan.Bloomberg’ning aniqlik kiritishicha, Tesla aksiyalari o‘zini o‘zi boshqaradigan avtomobillar uchun qoidalarni soddalashtirish va kompaniya raqobatchilari uchun soliq imtiyozlarini bekor qilish kutilayotgan bir vaqtda 65 foizga oshdi. Shuningdek, Maskning sun’iy intellekt sohasidagi xAI startapi narxi ikki baravar ko‘proqqa baholanmoqda.Uning qiymati prezidentlik saylovlari tugaganidan keyin 50 milliard dollarga yetgan edi. SpaceX shu hafta xodimlar va boshqa insayderlardan aksiyalarni sotib olish bo‘yicha 1,25 milliard dollarlik bitimni yakunlab, kompaniyaning baholangan qiymatini 350 milliard dollarga yetkazdi. Shundan so‘ng SpaceX dunyodagi eng qimmat xususiy kompaniyaga aylandi."
Jamiyat,УЕФА Чемпионлар лигаси 6-тури якунланди,,"12 декабрга ўтар кечаси УЕФА Чемпионлар лигаси умумий босқичи 6-турининг барча ўйинлари якунига етди.«Барселона» Дортмундда «Боруссия» устидан ғалаба қозонди, «Манчестер Сити» Туринда «Ювентус»га имкониятни бой берди.«Арсенал» «Монако»ни, «Штутгарт» эса «Янг Бойз»ни йирик ҳисобда енгди, «Милан» «Црвена Звезда»дани доғда қолдирди, «Фейеноорд» «Спарта» устидан ишончли ғалаба қозонди.«Бенфика» ва «Болоня» ўйинида дуранг қайд этилиб, мухлислар голсиз қолишди.ЕЧЛ 6-тур натижалари:Ювентус — Манчестер Сити 2:0Голлар: Влаҳович (53), Маккенни (75).Боруссия Д — Барселона 2:3Голлар: Гирасси (60 пеналти, 78) — Рафиня (53), Торрес (75, 85).Арсенал — Монако 3:0Голлар: Сака (34, 78), Ҳаверц (88).Милан — Црвена Звезда 2:1Голлар: Леау (42), Абраҳам (88) — Радонич (67).Фейеноорд — Спарта 4:2Голлар: Траунер (8), Пайшао (10), Ҳаж-Муса (50), Хименес (63) — Раҳмани (43), Белен (80, автогол).Штутгарт — Янг Бойз 5:1Голлар: Штиллер (25), Мийо (53), Фюрих (61), Вагноман (66), Кейтел (76) — Лакоми (6).Бенфика — Болоня 0:0"
Jamiyat,Samarqandda bir kechada bog‘cha va metan zapravkada yong‘in sodir bo‘ldi,,"11 dekabr kuni Samarqand viloyati Pastdarg‘om tumanida joylashgan bog‘cha va metan zapravkada yong‘in sodir bo‘lgani aks etgan video ijtimoiy tarmoqlarga sizdirildi. Ushbu holat yuzasidan Samarqand viloyati FVB Matbuot xizmati maʼlumot berdi.Unga ko‘ra, joriy yilning 11 dekabr kuni soat 20:40 da Pastdarg‘om tumani Amir Temur mahallasida joylashgan maktabgacha taʼlim muassasasi binosida yong‘in sodir bo‘lgan.Shunga ko‘ra, 5 ta yongg‘in-qutqaruv ekipajlari jalb qilinib, voqea  joyiga  soat 20:43 da yetib borgan va soat 21:55 da yong‘in to‘liq bartaraf etilgan.Yong‘in natijasida maktabgacha taʼlim tashkiloti binosining shift va tom qismi yonib zararlangan.Hozirda tergovga qadar tekshirish ishlari olib borilib, yong‘inning kelib chiqish sababi anqlanmoqda.Yana bir holatda esa, avtomobillarga suyultirilgan va siqilgan gaz quyish shahabchasida yong‘in sodir bo‘lgan.Kecha, 11 dekabr kuni soat 21:00 da Pastdarg‘om tumani Go‘zalkent qo‘rg‘oni Go‘zalkent mahallasida joylashgan Avtomobillarga suyultirilgan va siqilgan gaz quyish shahabchasida yong‘in sodir bo‘lgan.Shunga ko‘ra, 5 ta yong‘in-qutqaruv ekipajlari voqea  joyiga  soat 21:27 da yetib borgan va yong‘in soat 21:50 da to‘liq bartaraf etilgan.Shaxobchada suyultirilgan gaz yoqilg‘isini (propan) to‘kib olish jarayonida texnologik jarayonlarni buzilishi natijasida  vintelda gazning lokal yonish sodir bo‘lgan.Yonish natijasida bino-inshoatlarga va texnika vositalariga zarar etmagan.Har ikkala holatda hodisa oqibatida jabrlangan va halok bo‘lganlar aniqlanmagan.Hozirda tergovga qadar tekshirish ishlari olib borilmoqda."
Jamiyat,16-dekabrdan 41M-sonli “TTZ AShB – Bo‘z bozor bekati” yo‘nalishli taksi harakati qayta tiklanadi,,"2024-yil 16-dekabr sanasidan boshlab, vaqtincha faoliyati to‘xtatilgan 41M-sonli “TTZ AShB – Bo‘z bozor bekati” yo‘nalishli taksi harakati qayta tiklanadi. Bu haqda Transport vazirligi matbuot xizmati xabar qildi.Xaydarobod mahallasi aholisi tomonidan kelib tushgan ko‘plab murojaatlar asosida mazkur yo‘nalish quyidagicha o‘zgartiriladi:TTZ AShB – Yuzrabot ko‘chasi – M.Ulug‘bek ko‘chasi – Xaydarobod mahallasi bekati."
Jamiyat,Turizmni tabiat bilan uyg‘unlikda rivojlantirishga oid o‘quv seminari boshlandi,,"O‘zbekiston Respublikasi Prezidenti huzuridagi Davlat boshqaruvi akademiyasida ijro hokimiyati organlari rahbar kadrlari, tuman (shahar) sektorlari rahbarlari uchun o‘quv-amaliy seminar boshlandi. Tadbir davlat rahbarining 2024 yil 18–20 noyabr kunlari Oliy Majlis Senati va Qonunchilik palatasida so‘zlagan nutqlari, shuningdek, 2025 yil «Atrof-muhitni asrash va yashil iqtisodiyot yili» deb e’lon qilinishi munosabati bilan rahbarlar oldida turgan vazifalarni chuqur o‘rganishga yo‘naltirildi.Seminarni O‘zbekiston Respublikasi Bosh vaziri Abdulla Aripov ochib berdi. Tadbirda, shuningdek, O‘zbekiston Respublikasi Oliy Majlis Senati raisi Tanzila Narbayeva, O‘zbekiston Respublikasi Prezidenti maslahatchisi G‘ofurjon Mirzayev, Ekologiya, atrof-muhitni muhofaza qilish va iqlim o‘zgarishi vaziri Aziz Abduhakimov, Ekologiya vazirligi va Turizm qo‘mitasi xodimlari, Davlat boshqaruvi akademiyasi rektori Adham Bekmurodov hamda OAV vakillari ishtirok etishdi.O‘quv seminarida bioxilma-xillikni asrash, muhofaza etiladigan tabiiy hududlar faoliyati, ekoturizmni rivojlantirish hamda zamonaviy dam olish maskanlarini tashkil etish bo‘yicha ilg‘or tajribalar bilan bo‘lishildi, mavzuga doir qator taqdimotlar o‘tkazilib, zarur tavsiyalar berildi. Shuningdek, turizm infratuzilmasini modernizatsiya qilish va yangi zamonaviy xizmat turlarni joriy etish masalalari muhokama qilindi.Ekologiya, atrof-muhitni muhofaza qilish va iqlim o‘zgarishi vaziri Aziz Abduhakimov kuni kecha Prezident Shavkat Mirziyoyevning Toshkent viloyati Bo‘stonliq tumaniga tashrifi doirasida «Chorvoq darvozasi» va «Ugam River» turizm majmualarida bergan topshiriqlariga muvofiq sektor rahbarlariga taqdimot o‘tkazdi hamda ularning o‘z hududlarida shunga doir olib borishi mumkin bo‘lgan ishlarini muhokama qildi. Shu bilan birga, Bo‘stonliqda tashkil etilayotgan kapsula uylardan iborat zamonaviy dam olish maskaniga alohida to‘xtalib o‘tildi, zero bunday maskanlar ekologik nuqtai nazardan ayni muddaodir. Sektor rahbarlari ham o‘z hududlari doirasida ushbu yo‘nalishlarda amalga oshirish mumkin bo‘lgan ishlar bilan bo‘lishishdi.Turizm qo‘mitasi raisi Umid Shadiyev esa davlat rahbari tomonidan belgilab berilgan ustuvor vazifalar, shu jumladan, turizm infratuzilmasini rivojlantirish, rekreatsiya zonalarini tashkil etish va sohadagi mavjud muammolarni hal etish bo‘yicha ko‘rilayotgan chora-tadbirlarga to‘xtaldi. Shuningdek, joylashtirish vositalari va modulli mehmonxonalar uchun ajratilayotgan subsidiyalar to‘g‘risida ham ma’lumot berildi. Bu subsidiyalar turizm sohasini rivojlantirishga qaratilgan davlat siyosatining muhim bir qismi bo‘lib, sohadagi infratuzilmaning yaxshilanishiga va yangi investitsiyalar tartibini tashkil etishga yordam beradi.Bundan tashqari, seminarda davlat va xususiy sektor o‘rtasidagi hamkorlikni mustahkamlash, turizm infratuzilmasini rivojlantirishdagi yangi tendensiyalar muhokama qilindi. Turizmning ekologik, iqtisodiy va ijtimoiy jihatlardan barqaror rivojlanishini ta’minlash uchun kompleks choralar ishlab chiqish muhimligi ta’kidlandi.Tadbir ishtirokchilari Toshkent viloyatining turistik imkoniyatlari bilan yaqindan tanishish uchun Bo‘stonliq tumaniga borishi ko‘zda tutilgan.Ta’kidlash joizki, seminar natijalari O‘zbekiston turizm sohasining global bozordagi raqobatbardoshligini mustahkamlash va ekoturizm, etnoturizm, ekstremal turizm kabi yo‘nalishlarni yanada rivojlantirish hamda mahalliy aholi uchun yangi ish o‘rinlarini yaratishga xizmat qilishi kutilmoqda."
Jamiyat,IHT Isroilning Suriyaga qarashli hududlarni ishg‘ol qilgani va infratuzilma obyektlariga zarbalar berganini keskin qoraladi,,"Islom hamkorlik tashkiloti (IHT) Isroilning Suriyaga qarashli hududlarni ishg‘ol qilgani va infratuzilma obyektlariga zarbalar berganini keskin qoraladi.Joriy yil 8-dekabr kuni Suriyada Bashar Asad hokimiyati qulab, o‘zi Moskvaga qochganidan keyin Isroil qo‘shini Jo‘lon tepaligidagi qurolsizlantirilgan zonani kesib o‘tib Suriya hududiga bostirib kirdi. Strategik ahamiyatga ega Ash-Shayx tog‘ini egalladi va Quneytra muzofotidagi qishloqlarda kommendantlik soati joriy qildi.IHTga ko‘ra, Isroil bu harakatlari bilan BMT rezolyutsiyalari va xalqaro huquqni jiddiy ravishda buzdi.Ta’kidlanishicha, Suriyaning suvereniteti va hududiy yaxlitligi hurmat qilinishi va barqarorlik saqlanishi lozim.""IHT bosh kotibiyati Suriya xalqini qo‘llab-quvvatlaydi va uning siyosiy tanlovini hurmat qiladi. Biz mamlakatdagi barcha siyosiy partiyalarni Suriya xalqi manfaatlarini himoya qilish borasida mas’uliyatni tan olishga chaqiramiz. Siyosiy partiyalarni hukumatning o‘tish davri tinch va xavfsiz sharoitda, Suriya Arab Respublikasining hududiy yaxlitligi va institutlari faoliyati kafolatlangan tarzda kechishiga da’vat etamiz"", – deyiladi xalqaro tashkilot bayonotida."
Jamiyat,Markaziy Osiyoda odam savdosi ko‘rsatkichlari pasaymayapti – BMT,,"Dunyo bo‘ylab odam savdosi qurbonlari soni COVID-19 pandemiyasi davrida vaqtinchalik pasayishdan keyin yana ortib bormoqda. Bu haqda Birlashgan Millatlar Tashkilotining Narkotiklar va jinoyatchilik bo‘yicha boshqarmasi (UNODC) hisobotida aytiladi.156 mamlakat ma’lumotlarini o‘z ichiga olgan yangi hisobot xavotirli tendensiyalarni ta’kidlaydi. Unga ko‘ra, 2019-2022 yillar davomida qurbonlar soni 25 foizga oshgan.Ta’kidlanishicha, asosiy sabablar qashshoqlik, qurolli to‘qnashuvlar va iqlim inqirozi bo‘lib, odamlarni jinoyatchilar qarshisida zaif holga keltirgan. Ayniqsa, bolalarni ekspluatatsiya qilish va majburiy mehnatga jalb qilish holatlari ko‘paygani e’tiborga molik.«Jinoyatchilar tobora ko‘proq odamlarni majburiy mehnatga, jumladan, murakkab onlayn firibgarlik va kiberjinoyatlarga jalb qilmoqda. Ayni paytda ayollar va qizlar jinsiy ekspluatatsiya va gender asosidagi zo‘ravonlik tahdidiga duch kelmoqda», dedi BMT Narkotiklar va jinoyatchilik bo‘yicha boshqarmasi ijrochi direktori Gada Vali.Jinoiy tarmoqlar tepasida turganlarni javobgarlikka tortish, qurbonlarni qutqarish va jabrlanganlarga yordam ko‘rsatish bo‘yicha mamlakatlar o‘rtasidagi sa’y-harakatlarni muvofiqlashtirish uchun ta’qiblarni kuchaytirish kerak, deb qo‘shimcha qildi u.UNODC ma’lumotlariga ko‘ra, 2022 yilda odam savdosiga yo‘liqqan bolalar soni 2019 yilga nisbatan 31 foizga, qizlar o‘rtasida esa 38 foizga oshgan.«Qayerda ota-onasidan ajralgan yoki kattalar nazoratisiz qolgan bolalar ko‘p bo‘lsa, o‘g‘il bolalar odam savdosi bilan shug‘ullanuvchilar qo‘liga tushib qolish ehtimoli ko‘proq», deyiladi hisobotda.Yuqori daromadli mamlakatlarda ham bolalar savdosi kuchaymoqda, ko‘pincha qizlar jinsiy ekspluatatsiyaga uchrayapti. Tadqiqot shuni ko‘rsatdiki, ayollar va qizlar butun dunyo bo‘ylab aniqlangan qurbonlarning aksariyatini yoki 61 foizini tashkil etadi. Qizlarning aksariyati - 60 foizi - jinsiy ekspluatatsiya qilish uchun odam savdogarlari tomonidan o‘z tarmoqlariga jalb qilingan.O‘g‘il bolalarning 45 foizi majburiy mehnatga jalb qilingan bo‘lsa, 47 foizi boshqa ekspluatatsiya, jumladan, jinoiy faoliyat va tilanchilik bilan shug‘ullanadi.Jinoiy faoliyatga jalb qilish maqsadida odam savdosi, shu jumladan onlayn firibgarlik ekspluatatsiyaning aniqlangan turlari orasida uchinchi o‘rinni egalladi. Bu ko‘rsatkich 2016 yildagi bir foizdan 2022 yilda sakkiz foizga oshgan.Hisobot shuni ko‘rsatadiki, odam savdosi dinamikasi mintaqalar bo‘yicha farqlanadi.Shimoliy Amerika, G‘arbiy Yevropa va Sahroi Kabirdan janubiy Afrikadagi mamlakatlarda aniqlangan holatlar sezilarli darajada oshgan bo‘lsa-da, Janubiy Amerika, Sharqiy Yevropa va Markaziy Osiyo kabi mintaqalar hali ham pandemiyadan oldingi darajadan past emas."
Jamiyat,Qo‘shtepa kanali qurilishining ikkinchi bosqichida 81% ish yakunlandi,,"Qo‘shtepa kanali ikkinchi bosqichining 81 foizi va ushbu kanal to‘g‘oni qurilishining 67 foizi yakunlandi. Bu haqda Afg‘oniston Milliy taraqqiyot kompaniyasi ma’lum qildi.Bu katta irrigatsion loyiha Amudaryo suvini Afg‘onistonning ayrim hududlariga olib o‘tish uchun amalga oshirilmoqda va bu Markaziy Osiyo mamlakatlari orasida xavotirlarga sabab bo‘lmoqda.Qobuldagi IRNA muxbirining xabariga ko‘ra, Afg‘onistonning Milliy taraqqiyot kompaniyasi mas’ullari bir necha kun avval rasmiy bayonot berib, Qo‘shtepa kanali ikkinchi bosqichidagi ishlar 81 foizga yakunlanganini va kanalning bosh to‘g‘oni qurilishida 67 foiz progressga erishilganini ma’lum qildi.Bayonotga ko‘ra, kanal ustida to‘rtta ko‘prik qurilishi davom etmoqda va kelgusida Qo‘shtepa kanali yo‘nalishida yana boshqa ko‘priklar ham quriladi. Qo‘shtepa kanali birinchi bosqichi yakunlangandan so‘ng, uning ikkinchi bosqichi Balx viloyatining Davlatobod tumanida boshlanib, Faryob viloyatining Andxo‘y tumanigacha 128 kilometr uzunlikdagi hududda jadal amalga oshirilmoqda.Amudaryo, yoki Jayxun, Markaziy Osiyoning eng suvli daryosi bo‘lib, uning manbai Pomir tog‘laridan boshlanadi. Daryo Afg‘onistonning Tojikiston, O‘zbekiston va Turkmaniston chegaralari bo‘ylab taxminan 1126 kilometr uzunlikda oqadi. Garchi daryoning asosiy oqimi Orol dengiziga yo‘naltirilgan bo‘lsa-da, suvning barchasi yo‘ldagi qishloq xo‘jaligi kanallari orqali iste’mol qilib yuborilmoqda.2021 yilda Afg‘onistonda “Tolibon” muvaqqat hukumati ish boshlaganidan so‘ng, daryoning sezilarli qismini mamlakat ichkarisiga olib o‘tish maqsadida Balxdan Faryobgacha 300 kilometr uzunlikda va 15 metr kenglikda katta suv kanali qurishga qaror qilindi. Ular bu tashabbusni qishloq xo‘jaligi va oziq-ovqat sanoatini rivojlantirish maqsadida 2022 yil aprel oyida Balx viloyatida ishlarni boshlaganini va uni 5 yil ichida yakunlashni rejalashtirayotganini e’lon qildi."
